id	path	surface_kind	owner	thin_client_boundary	proof	ios_tests	scorecard_rows
IOSTC-INV-102	packages/agent/tests/self_sufficient_agent_runtime_readiness_invariants.rs	predecessor_inventory	ssarr-owner	SSARR invariant rejects iOS successor product panel reintroduction	SSARR invariant	static gate	IOSTC-9,IOSTC-10
IOSTC-INV-103	packages/agent/docs/primitive-minimality-closure-scorecard.md	predecessor_inventory	pmc-owner	PMC scorecard records no Swift source changes	PMC invariant	static gate	IOSTC-9,IOSTC-10
IOSTC-INV-104	packages/agent/docs/primitive-minimality-closure-evidence-manifest.md	predecessor_inventory	pmc-owner	PMC evidence records XcodeGen drift validation and no-touch iOS rationale	PMC invariant	static gate	IOSTC-9,IOSTC-10
IOSTC-INV-105	packages/agent/docs/primitive-minimality-closure-inventory.md	predecessor_inventory	pmc-owner	PMC inventory classifies iOS as no behavior-change scope	PMC invariant	static gate	IOSTC-9,IOSTC-10
IOSTC-INV-106	packages/agent/docs/primitive-minimality-closure-inventory.tsv	predecessor_inventory	pmc-owner	PMC TSV keeps iOS no-touch scope machine-checkable	PMC invariant	static gate	IOSTC-9,IOSTC-10
IOSTC-INV-107	packages/agent/tests/primitive_minimality_closure_invariants.rs	predecessor_inventory	pmc-owner	PMC invariant rejects iOS source behavior changes in the closure diff	PMC invariant	static gate	IOSTC-9,IOSTC-10
