id	feature_family	old_evidence_paths	current_replacement_or_gap	classification	primitive_owner	capability_owner	ios_surface	authority_data_owner	memory_involvement	backend_dependency	recommended_slice	user_decision_needed	validation_requirement	status	bprc_refs	iarm_refs	scorecard_rows
P2AER-INV-001	engine primitive substrate	README.md;packages/agent/src/lib.rs;packages/agent/src/domains/mod.rs;packages/agent/docs/baseline-pre-restoration-closure-inventory.tsv	Current substrate exists: execute primitive, catalog, grants, resources, queues, streams, triggers, ledger, replay, event store, external-worker protocol.	true_primitive	engine owner	none	README/server facts	engine-owned resources and events	audit_only	engine_substrate	Slice 0	Confirm provider-visible execute remains singular.	PCC/TPC/HRA/BPRC/SSARR invariants plus README audit	current_baseline	BPRC-INV-012;BPRC-INV-013;BPRC-INV-014;BPRC-INV-015;BPRC-INV-016	IARM-SURFACE-022	P2AER-0;P2AER-3;P2AER-6
P2AER-INV-002	capability discovery catalog routing intent conformance	packages/agent/docs/primitive-baseline-vs-modular-capability-engine-feature-index.md#1-capability-discovery-routing-and-intent-execution;packages/agent/docs/baseline-pre-restoration-closure-inventory.tsv	Slice 1 implemented native `catalog_discovery::{search,inspect,conformance_report}` plus `execute` operations `catalog_search`, `catalog_inspect`, and `catalog_conformance`; search/inspect read metadata only and reports write durable evidence without executing discovered targets.	modular_capability_package	engine catalog/resource/stream owners	catalog_discovery package	Runtime Cockpit Discovery tab	server catalog/resources/streams	audit_only	module_contract	Slice 1	Runtime Cockpit selected; chat remains quiet unless attention is required.	Catalog visibility, protected omission, conformance resource/stream, replay/trace, iOS DTO/projection/client, SACB static guards	current_baseline	BPRC-FEATURE-01	IARM-SURFACE-005;IARM-SURFACE-007;IARM-SURFACE-008	P2AER-1;P2AER-2;P2AER-5
P2AER-INV-003	current workspace browser	packages/agent/docs/ios-affordance-restoration-progress.md#accepted-follow-up-work-server-backed-workspace-browser;packages/agent/src/domains/filesystem/mod.rs	Restored only get_home, list_dir, create_dir for paired-Mac workspace selection.	server_fact_rendering_only	filesystem workspace-browser domain	none	WorkspaceSelector server facts	filesystem domain	none	none	Slice 0	Keep current selector boundary separate from agent file tools.	Filesystem service tests, workspace selector tests, IARM invariant	current_baseline	BPRC-FEATURE-02	IARM-SURFACE-029;IARM-SURFACE-035	P2AER-0;P2AER-7
P2AER-INV-004	filesystem agent tool suite path authority sandbox previews	feature index section 2;IARM-SURFACE-035	Slice 4 implements bounded `filesystem_read`, `filesystem_list`, `filesystem_find`, `filesystem_glob`, `filesystem_search_text`, `filesystem_diff`, `filesystem_write`, `filesystem_edit`, and `filesystem_apply_patch` execute operations backed by the filesystem domain; paths resolve from trusted working-directory metadata, traversal/symlink escapes are denied, read/search/diff output is bounded, binary previews omit content, and mutating previews/commits create resource-backed patch/materialized-file evidence.	modular_capability_package	authority grants and resource kernel	filesystem package	generic result first; native file or patch review only after contract	filesystem package resources	audit_only	module_contract	Slice 4	Future user decision still needed for package-wide approval triggers and native destructive patch review UX.	Path traversal, symlink, bounded read/search/list, binary preview, diff/patch, idempotency, rollback evidence, replay/resource evidence, provider execute boundary, and iOS generic rendering checks	current_baseline	BPRC-FEATURE-02	IARM-SURFACE-035	P2AER-2;P2AER-5;P2AER-6
P2AER-INV-005	jobs processes shells long-running tasks cancel logs	feature index section 3;IARM-SURFACE-024	Slice 5A implements durable non-interactive jobs through a jobs domain, `job_process` resources, bounded `execution_output` artifacts, `jobs.lifecycle` stream evidence, start/status/list/log/cancel execute operations, direct cleanup, fail-closed `networkPolicy: none`, owned process-group timeout/cancel/shutdown cleanup, cancel-request-before-terminal finalization with stale-version retry, and retention archiving; PTY, native process UI, interpreters, web/git/subagent/scheduler behavior, and queue-backed internal dispatch remain deferred.	modular_capability_package	resource/stream/authority/trace/replay/output primitives	jobs package	generic job result/resource surface first; native process UI after protocol	job_process and execution_output resources	audit_only	module_contract	Slice 5A	Defer PTY/native UI/interpreter/network/git/subagent/scheduling decisions; queued internal dispatch requires a later grant model.	Job start/status/list/log/cancel, terminal idempotency, bounded output, timeout, inherited-pipe background child cleanup, process-exit/cancel race, forced cancel-request/finalization version conflict retry, shutdown cancellation, resource/schema/output contracts, fail-closed network policy, cleanup retention, SACB/TMB/CSD/PERF static guards	current_baseline	BPRC-FEATURE-03	IARM-SURFACE-024	P2AER-2;P2AER-5;P2AER-6
P2AER-INV-006	code interpreter program execution	feature index section 15	Accepted Slice 15A adds backend-only `domains/program_execution`, built-in `program_execution_record` resources, `program_execution.lifecycle` stream evidence, and execute-only `program_execution_record`, `program_execution_list`, and `program_execution_inspect` operations for content-free program execution metadata only. It stores runtime/language identifiers, resource-limit policy, I/O-envelope metadata, refs/fingerprints, lifecycle/trace/replay refs, and fingerprinted idempotency evidence while rejecting raw code, raw stdin/stdout/stderr, command strings, shell snippets, package-manager directives, runtime execution, process launch, file writes, live network behavior, unsafe paths, secrets, token-like material, and provider-visible raw payloads.	modular_capability_package	job/resource primitives	program_execution package	generic output surface first	program_execution_record resources	audit_only	module_contract	Slice 15A accepted	Choose supported runtime execution architecture, interpreter isolation, dependency/package policy, deterministic I/O materialization, and any native program-output UX after the accepted metadata foundation.	Exact program_execution authority/resource selectors, `programExecutionResourceId` authorization scanner coverage, bounded/redacted projections, deterministic injected timestamps with no program-execution DRC finding, no raw code/IO/command/path leakage, no runtime/process/package/network/file-write side effects	current_baseline	BPRC-FEATURE-15	IARM-SURFACE-035	P2AER-2;P2AER-5
P2AER-INV-007	worker protocol lifecycle resource leases conformance	packages/agent/docs/self-updating-worker-runtime-foundation-inventory.md;feature index section 6	Accepted Slice 9B adds read-only execute inspection operations worker_package_list and worker_package_inspect for bounded/redacted existing lifecycle records with explicit read grants, stored kind/schema revalidation, current-session/workspace scoping, direct authority-grant and grant-like metadata redaction, and no lifecycle mutation.	true_primitive	engine runtime and worker_lifecycle	worker package lifecycle	Agent Cockpit server facts	worker_package resources	audit_only	engine_substrate	Slice 9B accepted	Review package signing/source identity, agent self-proposal policy, and whether a later native package UI is warranted after the read-only backend proof.	Manifest, scoped token, conformance, resource lease, SACB external-worker tests, worker_package list/inspect authority/scope/kind/schema/bounds/redaction tests, provider schema non-goal rejection, and static inventory coverage	current_baseline	BPRC-FEATURE-06	IARM-SURFACE-022;IARM-SURFACE-032	P2AER-3;P2AER-6
P2AER-INV-008	self-extension MCP plugins external tool sources	feature index sections 6 and 14;IARM-SURFACE-032	Accepted Slice 9A adds an inert `tool_sources` domain, resource-backed `tool_source_proposal` and `tool_source_conformance_report` records, trusted internal-only proposal/report writes, and read-only execute operations `tool_source_list` and `tool_source_inspect`; live MCP start/restart, package install, catalog registration, tool execution, trust promotion, public `/engine` API expansion, browser/search/crawl/login scope, and native fixed UI remain absent.	modular_capability_package	catalog/grant/resource/worker protocol	source_package and MCP packages	Generic resource rendering first; Agent Cockpit source UI after full contract	tool_source_proposal and tool_source_conformance_report resources	audit_only	module_contract	Slice 9A	Define trusted source roots, MCP trust policy, package signing, install/enable workflow, and native source UI in later slices.	Tool-source proposal authority, idempotency, session isolation, secret rejection, unsafe path rejection, schema bounding/truncation, report creation, resource definitions, no activation/catalog registration, static non-goal guards, and independent review/fix-loop acceptance	current_baseline	BPRC-FEATURE-06;BPRC-FEATURE-14	IARM-SURFACE-032	P2AER-2;P2AER-5
P2AER-INV-009	subagents delegation worker launching	feature index section 7;IARM-SURFACE-026	Accepted Slice 10A adds inert `subagents` domain coverage and one `subagent_task` resource kind for lifecycle/provenance records. Accepted Slice 10B keeps `subagent_task` as the durable parent causality anchor and adds controlled `subagent_launch`, `subagent_status`, `subagent_result`, and `subagent_cancel` execute operations with explicit bounded placeholder model policy, one-running-task-per-scope concurrency, idempotency/freshness, bounded/redacted status/result projections, cancellation provenance, trace/replay refs, and proof that no worker/job/process/tool/network/package/result-merge side effects occurred.	modular_capability_package	resources/streams/grants	subagents domain	generic result first; native subagent chips after contract	subagent_task resources	audit_only	module_contract	Slice 10B accepted	Real child-agent execution, model-profile policy, approval triggers, result merge UX, actual spawn/status/result/cancel workers and iOS chips/sheets remain deferred, and native subagent chips remain later decisions for separately scoped slices.	Subagent launch/status/result/cancel, parent causality refs, authority denial, runtime grant/pre-handler authorization, scope isolation, kind/schema revalidation, untrusted stored-payload projection redaction/bounding, fail-closed broad selector denial, placeholder model policy denial, concurrency denial, cancellation stale-version/idempotency, bounded result/log evidence, no-worker/no-job/no-process/no-network static guards	current_baseline	BPRC-FEATURE-07	IARM-SURFACE-026	P2AER-2;P2AER-5
P2AER-INV-010	goals queues questions task planning user inbox	feature index section 8;IARM-SURFACE-027;IARM-SURFACE-028	Accepted Slice 7A adds execute-only durable backend goal/question lifecycle records, idempotent answer provenance, bounded lifecycle stream evidence, queue/resource refs, trace refs, and replay refs; goal execution, autonomous planning, prompt queue, work snapshot, native Work dashboard, ask_user UI, and answer submission UI remain absent until later contract/UI slices.	modular_capability_package	queue/resource/stream primitives	goals package	generic runtime/resource rendering first; Work dashboard or question sheet after backend contract	goal, user_question, and goal_answer resources	reads_memory	module_contract	Slice 7A	Default autonomy, interruption policy, and native Work/question UI remain later user decisions after backend proof.	Goal lifecycle, question lifecycle, answer expected-version/idempotency, expiry, scope isolation, bounded output, stream/replay refs, provider execute routing, resource authority/scope checks, and resource schema tests	current_baseline	BPRC-FEATURE-08	IARM-SURFACE-027;IARM-SURFACE-028	P2AER-1;P2AER-2;P2AER-5
P2AER-INV-011	approval safety freshness expiry	packages/agent/docs/security-authority-capability-boundaries-scorecard.md;feature index section 9;IARM-SURFACE-023	Slice 2 implements durable `approval_request` and `approval_decision` resources, `approval.lifecycle` stream events, idempotent decision recording, and a reusable fail-closed check for approved/denied/expired/pending/missing/malformed/stale/scope mismatch outcomes; Slice 2 hardening adds schema alignment coverage for resource kind/schema ids, output contracts, and persisted payload required fields; it does not add native iOS approval UI or choose risky default approval policy.	modular_capability_package	authority grant primitive plus resource/stream substrate	approval package	native approval surface after contract and policy decision	approval request/decision resources	audit_only	module_contract	Slice 2	Define risk-class taxonomy, default expiry windows, interruption behavior, and native approval UX before risky package rollout.	Approval resource/stream tests, fail-closed check tests, idempotency/revision tests, replay/evidence explanation tests, schema alignment guard, SACB/TMB/HRA/TPC/PCC invariants	current_baseline	BPRC-FEATURE-09	IARM-SURFACE-023	P2AER-2;P2AER-5;P2AER-6
P2AER-INV-012	web research browse fetch search	feature index section 4;IARM-SURFACE-030	Accepted Slice 8A adds execute-only `web_fetch`, `domains/web`, declared-network authority checks, bounded direct fetch, sanitized URL/final URL evidence, content type handling, deterministic truncation/redaction metadata, captured-byte SHA-256 evidence, idempotent `web_source` resource/cache evidence, trace/replay refs, and `web.lifecycle` stream evidence; Accepted Slice 8B adds execute-only read operations `web_source_list` and `web_source_inspect` for bounded current-session citation fields without network I/O; Accepted Slice 8C adds deterministic HTML/XHTML readable-text extraction before redaction, bounded/redacted textEvidence extraction metadata, raw-byte hash preservation, and old web_source compatibility without adding provider-visible web operations; Accepted Slice 8D adds execute-only `web_source_archive`, append-only archived lifecycle metadata, default active/fetched listing, explicit archived inclusion, exact archived inspect, and no-network archive/list/inspect behavior; Accepted Slice 8E adds execute-only `web_robots_check`, one-origin robots.txt fetch under declared network authority, `web.write`/`resource.read`/`resource.write`/`kind:web_robots_policy` authority checks, deterministic bounded `web_robots_policy` evidence, sitemap refs as metadata only, and production HTTPS-only robots fetches; Accepted Slice 8F adds optional `web_fetch` robots evidence linkage with paired `webRobotsPolicyResourceId` and `expectedWebRobotsPolicyVersionId`, exact current-session allow policy validation and non-displayed target fingerprint matching before target network I/O, bounded `robotsPolicyRefs` on web_source list/inspect, and conditional robots-policy read grants only when both robots fields are non-empty strings; search providers, browser automation, crawling beyond the single robots policy fetch, sitemap traversal, login/cookies/session reuse, deletion/pruning/automatic TTL cleanup, public `/engine` web APIs, native iOS source UI, and network-enabled jobs remain deferred to later Slice 8 sub-slices.	modular_capability_package	network authority and resource primitives	web_research package	generic source/provenance rendering	web_source and web_robots_policy resource evidence	audit_only	module_contract	Slice 8F accepted	Continue fresh discovery for the next Phase 2 slice while deferring search providers, browser automation scope, crawling, sitemap traversal, deletion/pruning/TTL cleanup, and native source UI until separate slices.	Network denial, deterministic loopback fetch, URL validation, redirect/final URL evidence, response/output truncation, source hash, redaction after extraction, idempotent cache replay, HTML extraction/noise removal, safe title redaction/bounds, JSON/XML/plain/binary/malformed/oversized/non-UTF8 behavior, old web_source inspection compatibility, web_source list/inspect scope/version/authority/bounds tests, web_source archive CAS/scope/authority/idempotency/filtering/inspect/no-network tests, robots allow/deny parser evidence, missing/malformed/oversized robots bodies, sitemap metadata-only behavior, robots authority fail-closed ordering, unsafe robots URL/redirect/DNS rejection, production HTTP loopback rejection, robots-linked fetch allow/deny/wrong-kind/wrong-session/stale-version/non-current/origin-target mismatch denial before target I/O, sensitive-query target fingerprint mismatch denial, explicit null robots field ordinary-fetch compatibility, missing robots-policy read grant denial, bounded robots refs in source list/inspect, provider schema non-goal rejection, IPv6 internal target rejection, static inventory coverage, and dependency review tests	current_baseline	BPRC-FEATURE-04	IARM-SURFACE-030	P2AER-2;P2AER-5
P2AER-INV-013	git worktrees source control branches diffs conflicts PRs	feature index sections 5 and 16;IARM-SURFACE-025;IARM-SURFACE-029	Slice 6A implements read-only Git status and staged/unstaged diff evidence through `git_status`/`git_diff`; accepted Slice 6B adds index-only Git stage/unstage through `git_stage`/`git_unstage`, `domains/git`, and `capability::execute`; stage/unstage require explicit trusted-root relative paths, idempotency, reason, expected HEAD, conflict rejection, bounded before/after evidence, `git_index_change` resources, and `git.lifecycle` stream events; accepted Slice 6C adds staged-index commit evidence only through `git_commit` with expected HEAD, expected index tree, idempotency, reason, hook/editor/signing suppression, HEAD drift guarding, `git_commit` resources, and `git.lifecycle` events; accepted Slice 6D adds local branch-start through `git_branch_start`, `git_branch_start` resources, and `git.branch_started` lifecycle evidence while preserving index/worktree content and avoiding checkout; accepted Slice 6E adds read-only local branch inventory evidence through `git_branch_inventory` in `domains/git` before any broader branch mutation; worktree graph resources, branch deletion/rename, arbitrary checkout, conflict workflows, merges, rebases, resets, stash/clean, fetch/pull/push, PR handoff, repo/tree/import domains, and SourceChanges native surface remain deferred.	modular_capability_package	filesystem/jobs/resources	git_worktree package	native source-control review after mutating server contract	git_index_change resource; git_commit resource; git_branch_start resource; future worktree resource graph	audit_only	module_contract	Slice 6E	Push/PR approval, branch deletion/rename policy, arbitrary checkout policy, worktree graph shape, and conflict delegation remain later source-control decisions.	Repo detection, clean/dirty state, staged/unstaged/untracked summaries, detached HEAD, missing/upstream ahead-behind, nested/non-repo/out-of-root paths, stale expected HEAD, absolute/traversal/missing paths, conflicted pathspecs, non-repo and nested-repo misuse, bounded/truncated status and diff output, textconv suppression, idempotency replay, git_index_change resource evidence, git.lifecycle stream events, staged-index commit freshness via expected head and expected index tree, hook/editor/signing suppression, merge/sequencer rejection, symbolic HEAD drift rejection, git_commit resource evidence, branch-start freshness/preservation/resource/stream evidence, branch inventory sorting/bounds/upstream/oversized-metadata evidence, and schema/static guards excluding non-goal Git operations	current_baseline	BPRC-FEATURE-05;BPRC-FEATURE-16	IARM-SURFACE-025;IARM-SURFACE-029	P2AER-2;P2AER-5
P2AER-INV-014	memory core contract hot-swappable engines	feature index section 10;IARM-SURFACE-034;SSARR inventory learned_rules_memory row	Slice 3 implements the memory domain, built-in memory_engine/memory_policy/memory_record/memory_prompt_trace/memory_eval_run/memory_migration_envelope resource definitions, disabled/active/shadow/compare policy state, redacted retain/edit/tombstone/list/inspect, migration import/export, and prompt trace audit with no hidden body-content inclusion.	true_primitive	resource/event/context primitives	memory contract with replaceable engines	generic resource/runtime audit first; native memory settings/audit still after workflow proof	memory resources and policy	memory_core	engine_substrate	Slice 3	Default remains explicit disabled until configured; future user decisions still own retention defaults, privacy classes, and automatic retention.	Memory schema, redaction, disabled mode, prompt inclusion trace, migration import/export, resource-backed output contracts, and no-hidden-body tests	current_baseline	BPRC-FEATURE-10	IARM-SURFACE-034	P2AER-4;P2AER-5
P2AER-INV-015	semantic vector memory retrieval engine	feature index section 1 fastembed/sqlite-vec removal;feature index section 10	Accepted Slice 18A adds metadata-only memory_query and memory_decision evidence primitives for bounded query intent, filters, selected/excluded refs, reason codes, redaction proof, trace/replay refs, deterministic timestamps, idempotency fingerprints, and explicit read-only execute authority/resource selectors; vector registry/search, embeddings, index rebuilds, ranking, and semantic retrieval remain absent behind that contract.	modular_capability_package	memory contract	semantic_memory engine package	memory audit comparison surface	memory_query and memory_decision evidence resources	reads_memory	module_contract	Accepted Slice 18A	Approve embeddings/local model/dependency policy and A/B eval datasets before any semantic retrieval engine.	Query/decision evidence schema, scope isolation, authority denial, stale/wrong-kind refs, redaction/bounds, lifecycle, deterministic timestamp, idempotency, no body/raw payload leakage, and execute grant selector tests	current_baseline	BPRC-FEATURE-01;BPRC-FEATURE-10	IARM-SURFACE-034	P2AER-4
P2AER-INV-016	episodic trace memory	feature index section 10;README trace/replay sections	Accepted Slice 18A records inert memory_query and memory_decision trace/replay refs and lifecycle evidence, but no episodic retrieval engine converts events into prompt memory.	modular_capability_package	trace/replay/event primitives	episodic_memory engine	generic trace and memory audit	trace_refs plus memory_query/memory_decision evidence resources	reads_memory	module_contract	Accepted Slice 18A	Decide which events can become episodic memory before any event-to-memory conversion.	Trace refs, stale event filtering, retrieval reason, privacy redaction, query/decision refs, no prompt-inclusion side-effect tests, and read-only execute grant selector tests	current_baseline	BPRC-FEATURE-10	IARM-SURFACE-034	P2AER-4
P2AER-INV-017	procedural skills rules hooks learned behavior	feature index section 10;IARM-SURFACE-021;IARM-SURFACE-034;AGENTS managed skills rule	Accepted Slice 11A adds inert procedural_record resources for skill/rule/hook/procedure provenance/eval/status metadata plus read-only procedural_state_list and procedural_state_inspect execute operations with trusted current-session/workspace context, explicit non-wildcard procedural.read/resource.read authority, procedural_record resource-kind grants, exact kind:procedural_record and proceduralKind:* selectors, stored kind/schema/version/status revalidation, bounded redacted projections, and proof that repo-managed skills, skill-copy/bootstrap prompt wiring, activation, triggers, learned behavior, autonomous execution, scheduler work, tool execution, worker/package/job/process/network launch, MCP lifecycle, package install/catalog registration, trust promotion, public /engine expansion, settings/profile migrations, browser/search/crawl/login scope, native fixed UI, and result merge remain absent.	modular_capability_package	resource/eval provenance primitives	procedural package	generic resource audit first; native procedure audit after contract	procedural_record resources	audit_only	module_contract	Accepted Slice 11A	Decide if agent-authored rules are allowed, required eval thresholds, trigger categories, disable/edit/delete semantics, and prompt-inclusion policy in later slices.	Procedural record resource schema, list/inspect authority and scope denial, stored kind/schema/version/status revalidation, malformed payload denial, bounds/truncation, secret/grant/env/path/raw metadata redaction, provider schema non-goal rejection, runtime grant scoping, no repo-managed skills or bootstrap skill-copy wiring, and relevant static inventory coverage	current_baseline	BPRC-FEATURE-10	IARM-SURFACE-021;IARM-SURFACE-034	P2AER-4;P2AER-5
