id	feature_family	old_evidence_paths	current_replacement_or_gap	classification	primitive_owner	capability_owner	ios_surface	authority_data_owner	memory_involvement	backend_dependency	recommended_slice	user_decision_needed	validation_requirement	status	bprc_refs	iarm_refs	scorecard_rows
P2AER-INV-018	prompt history snippets prompt artifacts	feature index section 11;IARM-SURFACE-020	Accepted Slice 16A adds backend-only `domains/prompt_artifacts`, built-in `prompt_artifact` resources, `prompt_artifacts.lifecycle` stream evidence, and execute-only `prompt_artifact_record`, `prompt_artifact_list`, and `prompt_artifact_inspect` operations for explicit opt-in prompt artifact metadata only. It stores artifact kind, title/summary/preview, content refs or fingerprints, retention state, lifecycle/trace/replay/source refs, and fingerprinted idempotency evidence while rejecting raw prompt bodies, provider-visible raw prompt payloads, automatic prompt-history capture, prompt injection/context inclusion, learned behavior, unsafe paths, secrets, token-like material, and raw idempotency keys.	modular_capability_package	resource/privacy primitives	prompt_artifact package	Prompt UI after resource contract; current recent input remains local	prompt_artifact resources	writes_memory	module_contract	Accepted Slice 16A	Choose native snippet/template UI, automatic prompt-history capture policy, prompt injection/context-inclusion semantics, learned behavior coupling, and settings/profile migration only after the accepted metadata foundation.	Exact prompt_artifact authority/resource selectors, `promptArtifactResourceId` authorization scanner coverage, bounded/redacted projections, deterministic injected timestamps with no prompt-artifact DRC finding, no raw prompt/provider payload/idempotency/path/secret leakage, no automatic capture/injection/learned-behavior side effects	current_baseline	BPRC-FEATURE-11	IARM-SURFACE-020	P2AER-1;P2AER-5
P2AER-INV-019	artifact store reports renders screenshots generated outputs	README install directory workspace tree;resource kernel docs	Generic resources, blobs, workspace folders, and Slice 3 memory bodyRef/reference custody exist; report/render package workflows remain future module work.	true_primitive	resource/blob/storage primitives	artifact-backed packages	generic runtime surfaces	artifact resources and blobs	writes_memory	engine_substrate	Slice 3	Future user decisions still own artifact retention defaults and native review workflows.	Blob refs, hashes, retention, replay, memory-record reference tests, and generic resource redaction tests	current_baseline	BPRC-FEATURE-10;BPRC-FEATURE-22	IARM-SURFACE-030;IARM-SURFACE-034	P2AER-4;P2AER-6
P2AER-INV-020	event protocol DTO persistence breadth	feature index sections 20 and 21;IARM-SURFACE-005;IARM-SURFACE-007	Accepted Slice 19A adds event catalog parity only: generated event count, README/progressive docs synchronization, loop-protocol domain guards, and retired product event rejection without adding variants or resurrecting DTOs.	true_primitive	event store and protocol owner	module packages own product events	iOS plugins only after server events	server events and iOS cache	audit_only	engine_substrate	Accepted Slice 19A	User decision per native surface; no stale DTO resurrection.	Event schema count/category docs parity, retired product event rejection, unknown fallback/replay compatibility, iOS decoder docs audit	current_baseline	BPRC-FEATURE-20;BPRC-FEATURE-21	IARM-SURFACE-005;IARM-SURFACE-007	P2AER-2;P2AER-6
P2AER-INV-021	database storage migrations retention tables	feature index section 22;README database schema	Accepted Slice 20A adds source-backed README Database Schema table-catalog parity against active SQLite schema sources while preserving the clean-break resource substrate and adding no new migration.	true_primitive	session/event/resource storage owners	module packages own projections	no direct iOS DB truth	server database/resources	audit_only	engine_substrate	Accepted Slice 20A	Future decisions still own when a package needs a table instead of resources.	README/schema-source parity guard, migration, rollback, retention, replay, storage-generation tests	current_baseline	BPRC-FEATURE-22	IARM-SURFACE-006;IARM-SURFACE-031	P2AER-2;P2AER-6
P2AER-INV-022	settings profile controls parity	feature index section 23;AGENTS settings parity rule	Slice 21A implementation candidate adds source-backed README Key Configuration/default parity and iOS editable-setting decode/update/state/UI catalog guards for current settings; removed module settings remain absent and no new setting or profile migration is introduced.	true_primitive	settings profile owner	module packages own settings fields	iOS control required for user-editable settings	settings profile	audit_only	engine_substrate	Slice 21A implementation candidate	User decision remains required for every future new setting default and iOS control shape.	README/default catalog parity, strict schema, default drift, sparse overlay, iOS editable-setting parity, no settings/profile migration	pending_review	BPRC-FEATURE-23	IARM-SURFACE-010;IARM-SURFACE-017;IARM-SURFACE-018	P2AER-2;P2AER-6;P2AER-7
P2AER-INV-023	dependency restoration review	feature index section 24;Cargo.toml current state	Removed dependencies remain absent until owning module requires them.	deferred	package owner per dependency	module packages	no direct iOS surface	package dependency policy	none	module_contract	Slice 14	Approve dependency per feature with security/profile review.	Cargo diff, license/security review, focused package tests, README dependency notes	planned	BPRC-FEATURE-24	IARM-SURFACE-032;IARM-SURFACE-035	P2AER-2;P2AER-6
P2AER-INV-024	model provider reasoning traces thought status streaming	packages/agent/docs/ios-affordance-restoration-progress.md#phase-1-slice-4-chat-visual-cues-status-and-error-affordances;README provider/model sections	Accepted Slice 17A adds metadata-only provider reasoning/status evidence at the existing model/responder audit and turn-persistence boundaries: requested reasoning level, provider/model ids, bounded stop/status, thinking-emitted boolean, reasoning/thought token counts, provider-audit refs, trace/replay refs, typed assistant/stream payload compatibility, and explicit redaction policy. It does not invent hidden chain-of-thought, persist raw provider reasoning payloads, add summaries, expose new provider-visible operations, or add native UI.	server_fact_rendering_only	model provider/responder owner	none	chat/capability evidence rendering	model audit, token records, catalog report resources	audit_only	engine_substrate	Accepted Slice 17A	Reasoning-used summary wording and native display remain deferred; catalog capability evidence renders only from current server facts.	Model audit redaction, provider stream boundary, assistant/turn-end streaming payload compatibility, token accounting, DRC protocol-doc parity, no raw reasoning/provider payload/path/secret leakage, provider-model boundary invariant, and no fake chain-of-thought tests	current_baseline	BPRC-FEATURE-20;BPRC-FEATURE-21	IARM-SURFACE-015;IARM-SURFACE-016	P2AER-1;P2AER-7
P2AER-INV-025	capability evidence rendering generated runtime surfaces	IARM-SURFACE-015;IARM-SURFACE-030;packages/ios-app/docs/architecture.md	Generic capability chips and generated runtime surfaces exist; Runtime Cockpit now adds a native Discovery tab backed by live catalog DTOs and `catalog_discovery_report` resources, with no fixed legacy product panel or generated-surface auto-publication.	server_fact_rendering_only	resource/runtime surface owner	module packages provide ui_surface	Runtime Cockpit discovery plus generic runtime surfaces	server resources	audit_only	none	Slice 1	Native Discovery tab approved because it is backed by current catalog/resource facts; further native surfaces still require stable contracts.	iOS renderer tests, DTO/projection/client tests, source guards, runtime surface schema tests	current_baseline	BPRC-FEATURE-19;BPRC-FEATURE-20	IARM-SURFACE-015;IARM-SURFACE-030	P2AER-7
P2AER-INV-026	APNs device broker notification inbox delivery badges	feature index section 12;IARM-SURFACE-019;IARM-SURFACE-033;Phase 1 Slice 6 progress ledger	Accepted Slice 13 adds server-owned `domains/device` and `domains/notifications`, built-in `device_registration`, `notification`, and `notification_delivery` resource schemas, `device.lifecycle` and `notifications.lifecycle` stream evidence, and execute-only `device_register`, `device_unregister`, `device_list`, `device_inspect`, `notification_send`, `notification_list`, `notification_inspect`, `notification_mark_read`, and `notification_mark_all_read` operations. raw APNs tokens never provider-visible; APNs environment is explicit; push defaults opt-in/disabled; no fake local inbox is created; live APNs transport, APNs entitlements, native iOS inbox, public notification APIs, and physical-device push delivery remain deferred.	modular_capability_package	device/notification resource primitives	device and notifications domains	native inbox and push after backend plus device proof	device_registration, notification, and notification_delivery resources	audit_only	module_contract	Accepted Slice 13	Decide live APNs provider credentials, native inbox/deep-link UX, and physical-device push validation in a later slice.	Device register/unregister, APNs token redaction, environment handling, read state, badge semantics, delivery failure evidence, retention defaults, authority/resource checks, scope isolation, replay refs, provider schema behavior, and iOS/APNs absence guards	current_baseline	BPRC-FEATURE-12	IARM-SURFACE-019;IARM-SURFACE-033	P2AER-1;P2AER-5;P2AER-7
P2AER-INV-027	event-backed notification families for tools	IARM Slice 6 deferral list source-control/process/job/subagent/approval/web/research/skills/rules/memory notifications	Accepted Slice 13 defines the server-owned event-family foundation: notification sends accept bounded families, device registrations store opt-in family policy, delivery evidence records family opt-out separately from disabled transport, and default families cover approval, question, goal, schedule, web, git, job, subagent, memory, and system records. Automatic routing from every owning feature event remains deferred to those feature packages.	deferred	notification resources	owning tool packages plus notification package	inbox rows after source events exist	tool resources and notification resources	reads_memory	module_contract	Accepted Slice 13	Choose per-feature notification defaults and routing triggers as each feature package lands.	Per-family validation, default family policy, family opt-out delivery evidence, no fake local inbox tests, provider schema non-goal rejection	current_baseline	BPRC-FEATURE-03;BPRC-FEATURE-04;BPRC-FEATURE-05;BPRC-FEATURE-07;BPRC-FEATURE-09;BPRC-FEATURE-10;BPRC-FEATURE-12	IARM-SURFACE-019	P2AER-1;P2AER-5
P2AER-INV-028	scheduling reminders automations background work	feature index section 17;IARM Phase 2 reminder	Accepted Slice 12 adds the scheduler domain, built-in schedule and schedule_run resource schemas, scheduler.lifecycle stream evidence, and execute-only schedule_create, schedule_list, schedule_inspect, schedule_cancel, and schedule_fire_due operations. Schedules record UTC-instant trigger policy, timezone labels, missed-run policy, explicit non-wildcard target resource kinds/actions/selectors, authority, retention, trace/replay refs, cancellation provenance, and leased explicit due evaluation with provider-visible evaluationAt; schedule_run records capture fired or skipped missed occurrences and background result evidence without executing feature work directly. Hidden cron tables, uncontrolled background loops, APNs/device notification delivery, public scheduler APIs, native fixed schedule UI, result merge, and autonomous planning remain deferred.	modular_capability_package	trigger/resource/lease/run-record primitives	scheduler package	schedule UI after contract	schedule and schedule_run resources	audit_only	module_contract	Accepted Slice 12	Decide richer schedule grammar, timezone conversion beyond UTC instants, feature-domain execution handoff, notification defaults, and native schedule UI in later slices.	Clock injection, explicit trigger firing, explicit evaluationAt, catch-up and skip missed-run behavior, cancellation terminality, runtime authority scopes, non-wildcard target validation, inspect redaction, bounded fire/inspect scans, durable resource schema validation, and CSD no-hidden-timer coverage	current_baseline	BPRC-FEATURE-17	IARM-SURFACE-035	P2AER-2;P2AER-5;P2AER-6
P2AER-INV-029	media voice notes persistent transcription audio storage	feature index section 13;IARM-SURFACE-011;IARM-SURFACE-031	Accepted Slice 14A adds backend-only media_artifact resource custody with blob refs, bounded metadata, retention, source/evidence refs, trace/replay refs, lifecycle evidence, redacted projections, MIME/size bounds, idempotent create/archive with fingerprinted idempotency evidence, and local transcription metadata only; native voice-note UI, capture permissions, server transcription model changes, provider-visible raw audio, imports, repository trees, and update diagnostics remain deferred.	modular_capability_package	artifact/storage primitives	media package	media UI after storage contract	media_artifact resources	audit_only	module_contract	Accepted Slice 14A	Decide media retention defaults beyond the backend foundation, native capture UX, import/repository tree coupling, and local/server processing policy in later slices.	Media bounds, MIME validation, redaction, retention, resource schema, lifecycle evidence, authority/scope isolation, idempotency fingerprint/redaction regressions, replay refs, and no raw-audio/provider projection leaks	current_baseline	BPRC-FEATURE-13	IARM-SURFACE-011;IARM-SURFACE-031	P2AER-1;P2AER-5;P2AER-7
P2AER-INV-030	import repository tree session history tooling	feature index section 16;IARM-SURFACE-029	Accepted Slice 14B adds backend-only `domains/import_history`, built-in `import_history_record` resources, `import_history.lifecycle` stream evidence, and execute-only `import_history_record`, `import_history_list`, and `import_history_inspect` operations for bounded generic session/resource lineage metadata only. Accepted Slice 14D adds backend-only `domains/repository_tree`, built-in `repository_tree_snapshot` resources, `repository_tree.lifecycle` stream evidence, and execute-only `repository_tree_snapshot`, `repository_tree_list`, and `repository_tree_inspect` operations for content-free repository tree metadata only. Accepted Slice 14E adds backend-only `domains/import_preview`, built-in `import_preview` resources, `import_preview.lifecycle` stream evidence, and execute-only `import_preview_record`, `import_preview_list`, and `import_preview_inspect` operations for content-free import preview metadata linking constrained import-history and repository-tree refs only. Raw import payloads, repository trees, unsafe paths, raw preview payloads, raw file contents, blob bytes, repository visualization, import execution, git mutation workflows, wildcard authority, provider-visible raw graph/tree/preview payloads, and native iOS session/import/tree UI remain deferred.	modular_capability_package	session/resource graph primitives	import_history;repository_tree;import_preview packages	generic graph first; native tree only with proof	import_history_record, repository_tree_snapshot, and import_preview resources	audit_only	module_contract	Accepted Slice 14B; Accepted Slice 14D; Accepted Slice 14E	Decide import source taxonomy, graph/tree/preview retention defaults, actual import execution/application semantics, and whether native tree UX is ever justified beyond generic graph rendering.	Import-history authority/resource checks plus accepted repository-tree authority/resource checks, bounded/redacted graph and tree metadata projections, path normalization/rejection, retention and trace/replay refs, lifecycle evidence, idempotency fingerprinting, deterministic timestamps with no import-history or repository-tree DRC finding, accepted repository-tree authority/resource checks plus accepted Slice 14E import-preview authority/resource checks, bounded/redacted preview projections, constrained linked import-history and repository-tree refs, wrong-kind/wrong-prefix ref rejection, SACB coverage, and no raw import/repository/preview/path leakage	current_baseline	BPRC-FEATURE-16	IARM-SURFACE-029	P2AER-2;P2AER-5;P2AER-7
P2AER-INV-031	system update diagnostics product surface	feature index section 18	Accepted Slice 14C adds backend-only `domains/update_diagnostics`, built-in `update_diagnostic_record` resources, `update_diagnostics.lifecycle` stream evidence, and execute-only `update_diagnostic_record`, `update_diagnostic_list`, and `update_diagnostic_inspect` operations for bounded signed-release metadata only. Raw update payloads, package bytes, production endpoint details, install/restart commands, deploy automation, live production update checks, package/catalog registration, public update APIs, and native iOS update panels remain deferred.	modular_capability_package	system/resource primitives	update_diagnostics package	Settings diagnostics after signed update contract	update_diagnostic_record resource	audit_only	module_contract	Slice 14C	Decide signed update check policy, approval UX, and native update status surface after accepted backend metadata foundation.	Update-diagnostic authority/resource checks, signed-release provenance metadata, bounded/redacted projections, retention and trace/replay refs, lifecycle evidence, idempotency fingerprinting, deterministic timestamps with no update-diagnostics DRC finding, and no raw update/package/endpoint/command leakage	current_baseline	BPRC-FEATURE-18	IARM-SURFACE-018	P2AER-2;P2AER-6
P2AER-INV-032	fixed iOS product panels	feature index section 19;IARM old UI rows	Old fixed process, source, subagent, approval, notification, skill, memory, and work panels absent.	reject_candidate	iOS architecture owner	owning backend package required	no fixed panel until generic insufficiency is proven	server package resources	none	ios_native_after_contract	Slice 14	Approve native surface only per stable workflow.	SourceGuard, iOS architecture, simulator screenshots, backend contract tests	planned	BPRC-FEATURE-19	IARM-SURFACE-022;IARM-SURFACE-024;IARM-SURFACE-025;IARM-SURFACE-026;IARM-SURFACE-028;IARM-SURFACE-034	P2AER-3;P2AER-7
P2AER-INV-033	local iOS affordances retained from Phase 1	IARM progress ledger	Attachment menu, local recent inputs, local errors, transcription, settings/onboarding/diagnostics, workspace selector, session list, and Runtime Cockpit diagnostics are current.	ios_surface_only	iOS local owners	none	current iOS shell	local iOS state and current server facts	none	none	Slice 0	No Phase 2 work should regress Phase 1 accepted UX.	Focused iOS tests and SourceGuard when touched	current_baseline	not_applicable	IARM-SURFACE-010;IARM-SURFACE-011;IARM-SURFACE-012;IARM-SURFACE-013;IARM-SURFACE-014;IARM-SURFACE-016;IARM-SURFACE-017;IARM-SURFACE-018;IARM-SURFACE-020	P2AER-1;P2AER-7
P2AER-INV-034	security sandbox path network authority boundary	SACB scorecard and evidence;feature index filesystem/process/web sections	Authority hardening exists, and Slice 2 adds approval as a reusable evidence/freshness gate consumed by future risky tool packages; existing authority grants remain the only execution-permission primitive; Slice 2 hardening prevents approval resource schema drift from weakening that evidence boundary.	true_primitive	authority grants owner	tool packages consume grants plus approval checks	no direct iOS surface	grant records plus approval evidence resources	audit_only	engine_substrate	Slice 2	Define per-package approval triggers, policy defaults, and risk-class mapping before filesystem/jobs/git/web rollout.	SACB authority, path, network, delegated invoke, secret custody, approval fail-closed, idempotency, replay/evidence, and schema alignment tests	current_baseline	BPRC-FEATURE-02;BPRC-FEATURE-03;BPRC-FEATURE-04;BPRC-FEATURE-09	IARM-SURFACE-023;IARM-SURFACE-035	P2AER-6
P2AER-INV-035	resource leases compensation rollback conformance evidence	SUWRF inventory;README engine protocol;BPRC entry contract	Slice 1 proves package-level conformance evidence with `catalog_discovery::conformance_report`: explicit idempotency, exclusive report lease, event-sourced compensation, `catalog_discovery_report` resource output contract, and `catalog.discovery` stream evidence.	true_primitive	engine resource/lease/compensation owners	module packages provide contracts	Runtime Cockpit report history	resource kernel and catalog.discovery stream	audit_only	engine_substrate	Slice 1	Strongest conformance evidence selected; user-facing UI shows high-signal status while lease/idempotency/compensation remain auditable metadata.	Resource lease, compensation, conformance resource/stream, replay/trace, iOS generic rendering tests	current_baseline	BPRC-FEATURE-01;BPRC-FEATURE-06;BPRC-FEATURE-22	IARM-SURFACE-022;IARM-SURFACE-030	P2AER-3;P2AER-6
