id	path	language	surface	owner	wire_direction	versioning	strictness	authority_or_idempotency	verification	ppacd_rows
PPACD-INV-078	packages/agent/src/domains/capability/media_contract.rs	Rust	server_protocol	capability-domain-owner	provider to engine	Media execute request fields are source-versioned beside the single capability::execute primitive	Capability contract tests assert media fields are present without adding separate provider tools	Media schema fields remain execute parameters and do not create public media API methods	Capability contract tests and PPACD invariant	PPACD-3,PPACD-4,PPACD-9
PPACD-INV-079	packages/agent/src/domains/capability/contract.rs	Rust	server_protocol	capability-domain-owner	provider to engine	Execute operation schema source-versioned inside the single `capability::execute` primitive	Schema tests cover prompt_artifact record list inspect fields and reject non-goal operations	Prompt artifact operations remain execute values and do not add public `/engine` methods or prompt-library APIs	Capability contract tests and PPACD invariant	PPACD-3,PPACD-4,PPACD-9
PPACD-INV-080	packages/agent/src/domains/capability/operations/prompt_artifacts.rs	Rust	server_protocol	capability-domain-owner	provider to engine	Adapter routes only prompt_artifact_record prompt_artifact_list and prompt_artifact_inspect through existing execute	Focused prompt-artifact tests require trusted context exact prompt/resource grants idempotency and redacted projections	Prompt artifacts remain a provider-visible execute operation family rather than public prompt API expansion	Prompt-artifact tests and PPACD invariant	PPACD-3,PPACD-4,PPACD-9
PPACD-INV-081	packages/agent/src/domains/prompt_artifacts/mod.rs	Rust	server_protocol	prompt-artifact-domain-owner	engine internal	Prompt-artifacts domain registers backend resource foundation functions behind domain registration without adding public HTTP methods	Focused prompt-artifact tests and capability contract tests validate execute-only access and no raw prompt projection	Prompt artifacts remain backend metadata custody; native prompt UI prompt injection automatic capture and public prompt APIs are deferred	Prompt-artifact tests and PPACD invariant	PPACD-3,PPACD-4,PPACD-9
PPACD-INV-082	packages/agent/src/domains/model/providers/openai/message_converter/mod.rs	Rust	server_protocol	model-provider-owner	provider instructions	Provider guidance documents prompt_artifact execute operations raw prompt rejection metadata-only storage and redacted projections	Message converter tests assert the prompt-artifact guidance remains in prompt clarification text	Provider instructions expose prompt artifacts as bounded execute operation values only and do not add provider-visible raw prompt or public API claims	Message converter tests and PPACD invariant	PPACD-3,PPACD-4,PPACD-9
PPACD-INV-083	packages/agent/src/domains/capability/prompt_artifacts_contract.rs	Rust	server_protocol	capability-domain-owner	provider to engine	Prompt-artifact execute request fields are source-versioned beside the single capability::execute primitive	Capability contract tests assert prompt-artifact fields are present without adding separate provider tools	Prompt-artifact schema fields remain execute parameters and do not create public prompt API methods	Capability contract tests and PPACD invariant	PPACD-3,PPACD-4,PPACD-9
PPACD-INV-084	packages/agent/src/domains/capability/module_install_contract.rs	Rust	server_protocol	capability-domain-owner	provider to engine	Module-install execute request and decision fields are source-versioned beside the single capability::execute primitive	Capability contract tests assert module-install fields are present without adding separate provider tools	Module-install schema fields remain execute parameters and do not create public install or marketplace API methods	Capability contract tests and PPACD invariant	PPACD-3,PPACD-4,PPACD-9
PPACD-INV-085	packages/agent/src/domains/capability/operations/module_install.rs	Rust	server_protocol	capability-domain-owner	provider to engine	Adapter routes only module_install_request and module_install_decision record/list/inspect through existing execute	Focused module-install tests require trusted context exact module-install/resource grants idempotency approval evidence and redacted projections	Module install remains a provider-visible metadata-only execute operation family rather than public install API expansion	Module-install tests and PPACD invariant	PPACD-3,PPACD-4,PPACD-9
PPACD-INV-086	packages/agent/src/domains/module_install/mod.rs	Rust	server_protocol	module-install-domain-owner	engine internal	Module-install domain registers backend resource foundation functions behind domain registration without adding public HTTP methods	Focused module-install tests and capability contract tests validate execute-only access and no physical install projection	Module install remains backend metadata custody; physical install activation package management public marketplace APIs and native panels are deferred	Module-install tests and PPACD invariant	PPACD-3,PPACD-4,PPACD-9
PPACD-INV-087	packages/agent/src/domains/model/providers/openai/message_converter/mod.rs	Rust	server_protocol	model-provider-owner	provider instructions	Provider guidance documents module-install execute operations approval gate requirements metadata-only storage and redacted projections	Message converter tests assert the module-install guidance remains in prompt clarification text	Provider instructions expose module install as bounded execute operation values only and do not add provider-visible physical install authority or public API claims	Message converter tests and PPACD invariant	PPACD-3,PPACD-4,PPACD-9
PPACD-INV-088	packages/agent/src/domains/capability/module_lifecycle_contract.rs	Rust	server_protocol	capability-domain-owner	provider to engine	Module-lifecycle execute request and decision fields are source-versioned beside the single capability::execute primitive	Capability contract tests assert module-lifecycle fields are present without adding separate provider tools	Module-lifecycle schema fields remain execute parameters and do not create public activation or marketplace API methods	Capability contract tests and PPACD invariant	PPACD-3,PPACD-4,PPACD-9
PPACD-INV-089	packages/agent/src/domains/capability/operations/module_lifecycle.rs	Rust	server_protocol	capability-domain-owner	provider to engine	Adapter routes only module_lifecycle request decision list inspect through existing execute	Focused module-lifecycle tests require trusted context exact module-lifecycle/resource grants idempotency approval evidence current-version freshness and redacted projections	Module lifecycle remains a provider-visible metadata-only execute operation family rather than public activation API expansion	Module-lifecycle tests and PPACD invariant	PPACD-3,PPACD-4,PPACD-9
PPACD-INV-090	packages/agent/src/domains/module_lifecycle/mod.rs	Rust	server_protocol	module-lifecycle-domain-owner	engine internal	Module-lifecycle domain registers backend resource foundation functions behind domain registration without adding public HTTP methods	Focused module-lifecycle tests and capability contract tests validate execute-only access and no activation execution projection	Module lifecycle remains backend metadata custody; runtime execution package management public marketplace APIs and native panels are deferred	Module-lifecycle tests and PPACD invariant	PPACD-3,PPACD-4,PPACD-9
